,Key,Name,File,Sex,Cludge,Text
25,nurse.,Nurse to Juliet,Globe_Shakespeare/rom.xml,0,Globe_Shakespeare/rom.xml-nurse.," Now, by my maidenhead, at twelve year old.
I bade her come. What, lamb! what, ladybird!
God forbid!   Where's this girl?     What, Juliet!
Enter JULIET.
 Your mother.

  I'll lay fourteen of my teeth,--
And yet, to my teen be it spoken, I have but four,--
She is not fourteen. How long is it now
To Lammas-tide?

 Even or odd, of all days in the year,
Come Lammas--eve at night shall she be fourteen.
Susan and she--God rest all Christian souls!
Were of an age: well, Susan is with God;
She was too good for me; but, as I said,
On Lammas-eve at night shall she be fourteen;
That shall she, marry; I remember it well.
'Tis since the earthquake now eleven years;
And she was wean'd,--I never shall forget it,--
Of all the days of the year, upon that day:
For I had then laid wormwood to my dug,
Sitting in the sun under the dove-house wall;
My lord and you were then at Mantua:--
Nay, I do bear a brain:--but, as I said,
When it did taste the wormwood on the nipple
Of my dug and felt it bitter, pretty fool,
To see it tetchy and fall out with the dug!
'Shake' quoth the dove-house: 'twas no need, I trow,
To bid me trudge:
And since that time it is eleven years;
For then she could stand alone; nay, by the rood,
She could have run and waddled all about;
For even the day before, she broke her brow:
And then my husband--God be with his soul!
A' was a merry man--took up the child:
'Yea,' quoth he, 'dost thou fall upon thy face?
Thou wilt fall backward when thou hast more wit;
Wilt thou not, Jule?' and, by my holidame,
The pretty wretch left crying and said, 'Ay.'
To see, now, how a jest shall come about!
I warrant, an I should live a thousand years,
I never should forget it: 'Wilt thou not, Jule?' quoth he;
And, pretty fool, it stinted and said 'Ay.'

 Yes, madam, yet I cannot choose but laugh,
To think it should leave crying and say 'Ay.'
And yet, I warrant, it had upon its brow
A bump as big as a young cockerel's stone;
A parlous knock; and it cried bitterly:
'Yea,' quoth my husband, 'fall'st upon thy face?
Thou wilt fall backward when thou comest to age;
Wilt thou not, Jule?' it stinted and said 'Ay.'

 Peace, I have done.   God mark thee to his grace!
Thou wast the prettiest babe that e'er I nursed:
An I might live to see thee married once,
I have my wish.

 An honour! were not I thine only nurse,
I would say thou hadst suck'd wisdom from thy teat.

 A man, young lady! lady, such a man
As all the world--why, he's a man of wax.

 Nay, he's a flower; in faith, a very flower.

 No less! nay, bigger; women grow by men.

 Go, girl, seek happy nights to happy days.
Exeunt. 
 Madam, your mother craves a word with you.

 Marry, bachelor,
Her mother is the lady of the house,
And a good lady, and a wise and virtuous:
I nursed her daughter, that you talk'd withal;
I tell you, he that can lay hold of her
Shall have the chinks.

 The son and heir of old Tiberio.

 Marry, that, I think, be young Petrucio.

 I know not.

 His name is Romeo, and a Montague;
The only son of your great enemy.

 What's this? what's this?

 Anon, anon!
Come, let's away; the strangers all are gone.

Exeunt.
 Madam!

 Madam!

                Now God in heaven bless thee! Hark, you, sir.

 Is your man secret?   Did you ne'er hear say,
Two may keep counsel, putting one away?

     Peter, stay at the gate.
Exit Peter.
 I am a-weary, give me leave awhile:
Fie, how my bones ache! what a jaunt have I had!

 Jesu, what haste? can you not stay awhile?
Do you not see that I am out of breath?

  Lord, how my head aches! what a head have I!
It beats as it would fall in twenty pieces.
My back o' t'other side,--O, my back, my back!
Beshrew your heart for sending me about,
To catch my death with jaunting up and down!

  O God's lady dear!
Are you so hot? marry, come up, I trow;
Is this the poultice for my aching bones?
Henceforward do your messages yourself.

 Have you got leave to go to shrift to-day?

 Then hie you hence to Friar Laurence' cell;
There stays a husband to make you a wife:
Now comes the wanton blood up in your cheeks,
They'll be in scarlet straight at any news.
Hie you to church; I must another way,
To fetch a ladder, by the which your love
Must climb a bird's nest soon when it is dark:
I am the drudge and toil in your delight,
But you shall bear the burden soon at night.
Go; I'll to dinner; hie you to the cell.

 Ay, ay, the cords.

Throws them down.
 Ah, well-a-day! he's dead, he's dead, he's dead!
We are undone, lady, we are undone!
Alack the day! he's gone, he's kill'd, he's dead!

 Romeo can,
Though heaven cannot: O Romeo, Romeo!
Who ever would have thought it? Romeo!

 I saw the wound, I saw it with mine eyes,--
God save the mark!--here on his manly breast:
A piteous corse, a bloody piteous corse;
Pale, pale as ashes, all bedaub'd in blood,
All in gore-blood; I swounded at the sight.

 O Tybalt, Tybalt, the best friend I had!
O courteous Tybalt! honest gentleman!
That ever I should live to see thee dead!

 Tybalt is gone, and Romeo banished;
Romeo that kill'd him, he is banished.

 It did, it did; alas the day, it did!

 There's no trust,
No faith, no honesty in men; all perjured,
All forsworn, all naught, all dissemblers.
Ah, where's my man? give me some aqua vitae:
These griefs, these woes, these sorrows make me old.
Shame come to Romeo!

 Will you speak well of him that kill'd your cousin?

 Weeping and wailing over Tybalt's corse:
Will you go to them? I will bring you thither.

 Hie to your chamber: I'll find Romeo
To comfort you: I wot well where he is.
Hark ye, your Romeo will be here at night:
I'll to him; he is hid at Laurence' cell.

 Let me come in, and you shall know my errand;
I come from Lady Juliet.

 O holy friar, O, tell me, holy friar,
Where is my lady's lord, where's Romeo?

 O, he is even in my mistress's case,
Just in her case!   O woful sympathy!
Piteous predicament!   Even so lies she,
Blubbering and weeping, weeping and blubbering.
Stand up, stand up; stand, an you be a man:
For Juliet's sake, for her sake, rise and stand;
Why should you fall into so deep an O?

 Ah sir! ah sir!   Well, death's the end of all.

 O, she says nothing, sir, but weeps and weeps;
And now falls on her bed; and then starts up,
And Tybalt calls; and then on Romeo cries,
And then down falls again.

 O Lord, I could have stay'd here all the night
To hear good counsel: O, what learning is!
My lord, I'll tell my lady you will come.

 Here, sir, a ring she bid me give you, sir:
Hie you, make haste, for it grows very late.

Exit.
 Madam

 Your lady mother is coming to your chamber:
The day is broke; be wary, look about.
Exit.
 God in heaven bless her!
You are to blame, my lord, to rate her so.

 I speak no treason.

 May not one speak?

 Faith, here it is.
Romeo is banish'd; and all the world to nothing,
That he dares ne'er come back to challenge you;
Or, if he do, it needs must be by stealth.
Then, since the case so stands as now it doth,
I think it best you married with the county.
O, he's a lovely gentleman!
Romeo's a dishclout to him: an eagle, madam,
Hath not so green, so quick, so fair an eye
As Paris hath.   Beshrew my very heart,
I think you are happy in this second match,
For it excels your first: or if it did not,
Your first is dead; or 'twere as good he were,
As living here and you no use of him.

 And from my soul too;
Or else beshrew them both.

 What?

 Marry, I will; and this is wisely done.
Exit. 
 Ay, forsooth.

 See where she comes from shrift with merry look.
Enter JULIET.
 They call for dates and quinces in the pastry.
Enter CAPULET.
 Go, you cot-quean, go,
Get you to bed; faith, you'll be sick tomorrow
For this night's watching.

 Mistress! what, mistress! Juliet! fast, I warrant her, she:
Why, lamb! why, lady! fie, you slug-a-bed!
Why, love, I say! madam! sweet-heart! why, bride!
What, not a word? you take your pennyworths now;
Sleep for a week; for the next night, I warrant,
The County Paris hath set up his rest,
That you shall rest but little. God forgive me,
Marry, and amen, how sound is she asleep!
I must needs wake her.   Madam, madam, madam!
Ay, let the county take you in your bed:
He'll fright you up, i' faith. Will it not be?
Undraws the curtains.
What, dress'd! and in your clothes! and down again!
I must needs wake you:   Lady! lady! lady!
Alas, alas!   Help, help! my lady's dead!
O, well-a-day, that ever I was born!
Some aqua vita, ho!   My lord! my lady!
Enter LADY CAPULET.
 O lamentable day!

 Look, look! O heavy day!

 She's dead, deceased, she's dead; alack the day!

 O lamentable day!

 O woe! O woful, woful, woful day!
Most lamentable day, most woful day,
That ever, ever, I did yet behold!
O day! O day! O day! O hateful day!
Never was seen so black a day as this:
O woful day, O woful day!

 Honest good fellows, ah, put up, put up;
For, well you know, this is a pitiful case.

Exit.
"
26,q.-kath.,QUEEN KATHARINE,Globe_Shakespeare/h8.xml,0,Globe_Shakespeare/h8.xml-q.-kath.," Nay, we must longer kneel: I am a suitor.

 Thank your majesty.
That you would love yourself, and in that love
Not unconsider'd leave your honour, nor
The dignity of your office, is the point
Of my petition.

 I am solicited, not by a few,
And those of true condition, that your subjects
Are in great grievance: there have been commissions
Sent down among 'em, which hath flaw'd the heart
Of all their loyalties: wherein, although,
My good lord cardinal, they vent reproaches
Most bitterly on you, as putter on
Of these exactions, yet the king our master--
Whose honour heaven shield from soil!-even he escapes not
Language unmannerly, yea, such which breaks
The sides of loyalty, and almost appears
In loud rebellion.

 No, my lord,
You know no more than others; but you frame
Things that are known alike; which are not wholesome
To those which would not know them, and yet must
Perforce be their acquaintance. These exactions,
Whereof my sovereign would have note, they are
Most pestilent to the hearing; and, to bear em,
The back is sacrifice to the load. They say
They are devised by you; or else you suffer
Too hard an exclamation.

 I am much too venturous
In tempting of your patience; but am bolden'd
Under your promised pardon.   The subjects' grief
Comes through commissions, which compel from each
The sixth part of his substance, to be levied
Without delay; and the pretence for this
Is named, your wars in France: this makes bold mouths:
Tongues spit their duties out, and cold hearts freeze
Allegiance in them; their curses now
Live where their prayers did: and it's come to pass,
This tractable obedience is a slave
To each incensed will. I would your highness
Would give it quick consideration, for
There is no primer business.

 I am sorry that the Duke of Buckingham
Is run in your displeasure.

 My learn'd lord cardinal,
Deliver all with charity.

 If I know you well,
You were the duke's surveyor, and lost your office
On the complaint o' the tenants: take good heed
You charge not in your spleen a noble person
And spoil your nobler soul: I say, take heed;
Yes, heartily beseech you.

 God mend all!

 Sir, I desire you do me right and justice;
And to bestow your pity on me: for
I am a most poor woman, and a stranger,
Born out of your dominions; having here
No judge indifferent, nor no more assurance
Of equal friendship and proceeding. Alas, sir,
In what have I offended you? what cause
Hath my behaviour given to your displeasure,
That thus you should proceed to put me off,
And take your good grace from me? Heaven witness,
I have been to you a true and humble wife,
At all times to your will conformable;
Ever in fear to kindle your dislike,
Yea, subject to your countenance, glad or sorry
As I saw it inclined: when was the hour
I ever contradicted your desire,
Or made it not mine too?   Or which of your friends
Have I not strove to love, although I knew
He were mine enemy? what friend of mine
That had to him derived your anger, did I
Continue in my liking? nay, gave notice
He was from thence discharged?   Sir, call to mind
That I have been your wife, in this obedience,
Upward of twenty years, and have been blest
With many children by you: if, in the course
And process of this time, you can report,
And prove it too, against mine honour aught,
My bond to wedlock, or my love and duty,
Against your sacred person, in God's name,
Turn me away; and let the foul'st contempt
Shut door upon me, and so give me up
To the sharp'st kind of justice. Please you, sir,
The king, your father, was reputed for
A prince most prudent, of an excellent
And unmatch'd wit and judgement: Ferdinand,
My father, king of Spain, was reckon'd one
The wisest prince that there had reign'd by many
A year before: it is not to be question'd
That they had gather'd a wise council to them
Of every realm, that did debate this business,
Who deem'd our marriage lawful: wherefore I humbly
Beseech you, sir, to spare me, till I may
Be by my friends in Spain advised; whose counsel
I will implore: if not, i' the name of God,
Your pleasure be fulfill'd!

 Lord cardinal,
To you I speak.

 Sir,
I am about to weep; but, thinking that
We are a queen, or long have dream'd so, certain
The daughter of a king, my drops of tears
I'll turn to sparks of fire.

 I will, when you are humble; nay, before,
Or God will punish me. I do believe,
Induced by potent circumstances, that
You are mine enemy, and make my challenge
You shall not be my judge: for it is you
Have blown this coal betwixt my lord and me;
Which God's dew quench! Therefore I say again,
I utterly abhor, yea, from my soul
Refuse you for my judge; whom, yet once more,
I hold my most malicious foe, and think not
At all a friend to truth.

 My lord, my lord,
I am a simple woman, much too weak
To oppose your cunning. You're meek and humble-mouth'd;
You sign your place and calling, in full seeming,
With meekness and humility; but your heart
Is cramm'd with arrogancy, spleen, and pride.
You have, by fortune and his highness' favours,
Gone slightly o'er low steps and now are mounted
Where powers are your retainers, and your words,
Domestics to you, serve your will as't please
Yourself pronounce their office. I must tell you,
You tender more your person's honour than
Your high profession spiritual: that again
I do refuse you for my judge; and here,
Before you all, appeal unto the pope,
To bring my whole cause 'fore his holiness,
And to be judged by him.

She curtsies to the King, and offers to depart.
 What need you note it? pray you, keep your way:
When you are call'd, return. Now, the Lord help,
They vex me past my patience!   Pray you, pass on:
I will not tarry; no, nor ever more
Upon this business my appearance make
In any of ther courts.

Exeunt Queen, and her Attendants.
 Take thy lute, wench: my soul grows sad with troubles;
Sing, and disperse 'em, if thou canst: leave working. How now!

 Would they speak with me?

 Pray their graces
To come near. [Exit Gent.
What can be their business
With me, a poor weak woman, fall'n from favour?
I do not like their coming. Now I think on't,
They should be good men; their affairs as righteous:
But all hoods make not monks.
Enter the two Cardinals, WOLSEY and CAMPEIUS.
 Your graces find me here part of a housewife,
I would be all, against the worst may happen.
What are your pleasures with me, reverend lords?

 Speak it here;
There's nothing I have done yet, o' my conscience,
Deserves a corner: would all other women
Could speak this with as free a soul as I do!
My lords, I care not, so much I am happy
Above a number, if my actions
Were tried by every tongue, every eye saw 'em,
Envy and base opinion set against 'em,
I know my life so even. If your business
Seek me out, and that way I am wife in,
Out with it boldly: truth loves open dealing.

 O, good my lord, no Latin;
I am not such a truant since my coming,
As not to know the language I have lived in:
A strange tongue makes my cause more strange, suspicious;
Pray, speak in English: here are some will thank you,
If you speak truth, for their poor mistress' sake;
Believe me, she has had much wrong: lord cardinal,
The willing'st sin I ever yet committed
May be absolved in English.

 To betray me.--
My lords, I thank you both for your good wills;
Ye speak like honest men; pray God, ye prove so!
But how to make ye suddenly an answer,
In such a point of weight, so near mine honour,--
More near my lfe, I fear,--with my weak wit,
And to such men of gravity and learning,
In truth, I know not. I was set at work
Among my maids: full little, God knows, looking
Either for such men or such business.
For her sake that I have been,--for I feel
The last fit of my greatness,--good your graces,
Let me have time and counsel for my cause:
Alas, I am a woman, friendless, hopeless!

 In England
But little for my profit: can you think, lords,
That any Englishman dare give me counsel?
Or be a known friend, 'gainst his highness pleasure,
Though he be grown so desperate to be honest,
And live a subject? Nay, forsooth, my friends,
They that must weigh out my afflictions,
They that my trust must grow to, live not here:
They are, as all my other comforts, far hence
In mine own country, lords.

 How, sir?

 Ye tell me what ye wish for both,--my ruin:
Is this your Christian counsel? out upon ye!
Heaven is above all yet; there sits a judge
That no king can corrupt.

 The more shame for ye: holy men I thought ye,
Upon my soul, two reverend cardinal virtues;
But cardinal sins and nollow hearts I fear ye:
Mend 'em, for shame, my lords. Is this your comfort?
The cordial that ye bring a wretched lady,
A woman lost among ye, laugh'd at, scorn'd?
I will not wish ye half my miseries;
I have more charity: but say, I warn'd ye;
Take heed, for heaven's sake, take heed, lest at once
The burthen of my sorrows fall upon ye.

 Ye turn me into nothing: woe upon ye
And all such false professors; would you have me--
If you have any justice, any pity;
If ye be any thing but churchmen's habits--
Put my sick cause into his hands that hates me?
Alas, has banish'd me his bed already,
His love, too long ago! I am old, my lords,
And all the fellowship I hold now with him
Is only my obedience. What can happen
To me above this wretchedness? all your studies
Make me a curse like this.

 Have I lived thus long--let me speak myself,
Since virtue finds no friends--a wife, a true one?
A woman, I dare say without vain-glory,
Never yet branded with suspicion?
Have I with all my full affections
Still met the king? loved him next heaven? obey'd him?
Been, out of fondness, superstitious to him?
Almost forgot my prayers to content him?
And am I thus rewarded? 'tis not well, lords.
Bring me a constant woman to her husband,
One that ne'er dream'd a joy beyond his pleasure;
And to that woman, when she has done most,
Yet will I add an honour, a great patience.

 My lord, I dare not make myself so guilty,
To give up willingly that noble title
Your master wed me to: nothing but death
Shall e'er divorce my dignities.

 Would I had never trod this English earth,
Or felt the flatteries that grow upon it!
Ye have angels' faces, but heaven knows your hearts.
What will become of me now, wretched lady!
I am the most unhappy woman living.
Alas, poor wenches, where are now your fortunes!
Shipwreck'd upon a kingdom, where no pity,
No friends, no hope; no kindred weep for me;
Almost no grave allow'd me: like the lily,
That once was mistress of the field and flourished,
I'll hang my head and perish.

 Do what ye will, my lords: and, pray, forgive me,
If I have used myself unmannerly;
You know I am a woman, lacking wit
To make a seemly answer to such persons.
Pray, do my service to his majesty:
He has my heart yet; and shall have my prayers
While I shall have my life. Come, reverend fathers,
Bestow your counsels on me: she now begs,
That little thought, when she set footing here,
She should have bought her dignities so dear.

[Exeunt.
"
27,kath.,QUEEN KATHARINE,Globe_Shakespeare/h8.xml,0,Globe_Shakespeare/h8.xml-kath.," O Griffith, sick to death!
My legs, like loaden branches, bow to the earth,
Willing to leave their burthen. Reach a chair:
So; now, methinks, I feel a little ease.
Didst thou not tell me, Griffith, as thou led'st me,
That the great child of honour, Cardinal Wolsey,
Was dead?

 Prithee, good Griffith, tell me how he died:
If well, he stepp'd before me, happily
For my example.

 Alas, poor man!

 So may he rest; his faults lie gently on him!
Yet thus far, Griffith, give me leave to speak him,
And yet with charity. He was a man
Of an unbounded stomach, ever ranking
Himself with princes, one that, by suggestion,
Tied all the kingdom: simony was fair-play;
His own opinion was his law: i' the presence
He would say untruths; and be ever double
Both in his words and meaning: he was never,
But where he meant to ruin, pitiful:
His promises were, as he then was, mighty;
But his performance, as he is now, nothing:
Of his own body he was ill, and gave
The clergy ill example.

 Yes, good Griffith;
I were malicious else.

 After my death I wish no other herald,
No other speaker of my living actions,
To keep mine honour from corruption,
But such an honest chronicler as Griffith.
Whom I most hated living, thou hast made me,
With thy religious truth and modesty,
Now in his ashes honour: peace be with him!
Patience, be near me still; and set me lower:
I have not long to trouble thee. Good Griffith,
Cause the musicians play me that sad note
I named my knell, whilst I sit meditating
On that celestial harmony I go to.

Sad and solemn music.
 Spirits of peace, where are ye? are ye all gone,
And leave me here in wretchedness behind ye?

 It is not you I call for:
Saw ye none enter since I slept?

 No? Saw you not, even now, a blessed troop
Invite me to a banquet; whose bright faces
Cast thousand beams upon me, like the sun?
They promised me eternal happiness;
And brought me garlands, Griffith, which I feel
I am not worthy yet to wear: I shall, assuredly.

 Bid the music leave,
They are harsh and heavy to me.
Music ceases.
 You are a saucy fellow:
Deserve we no more reverence?

 Admit him entrance, Griffith: but this fellow
Let me ne'er see again.

Exeunt Griffith and Messenger.
Re-enter GRIFFTH, with CAPUCIUS. 
If my sight fail not,
You should be lord ambassador from the emperor,
My royal nephew, and your name Capucius.

 O, my lord,
The times and titles now are alter'd strangely
With me since first you knew me.   But, I pray you,
What is your pleasure with me?

 O my good lord, that comfort comes too late;
'Tis like a pardon after execution:
That gentle physic, given in time, had cured me;
But now I am past all comforts here, but prayers.
How does his highness?

 So may he ever do! and ever flourish,
When I shall dwell with worms, and my poor name
Banish'd the kingdom! Patience, is that letter,
I caused you write, yet sent away?

 Sir, I most humbly pray you to deliver
This to my lord the king.

 In which I have commended to his goodness
The model of our chaste loves, his young daughter:
The dews of heaven fall thick in blessings on her!
Beseeching him to give her virtuous breeding,--
She is young, and of a noble modest nature,
I hope she will deserve well,--and a little.
To love her for her mother's sake, that loved him,
Heaven knows how dearly.   My next poor petition
Is, that his noble grace would have some pity
Upon my wretched women, that so long
Have follow'd both my fortunes faithfully:
Of which there is not one, I dare avow,
And now I should not lie, but will deserve,
For virtue and true beauty of the soul,
For honesty and decent carriage,
A right good husband, let him be a noble:
And, sure, those men are happy that shall have 'em.
The last is, for my men; they are the poorest,
But poverty could never draw 'em from me;
That they may have their wages duly paid 'em,
And something over to remember me by:
If heaven had pleased to have given me longer life
And able means, we had not parted thus.
These are the whole contents: and, good my lord,
By that you love the dearest in this world,
As you wish Christian peace to souls departed,
Stand these poor people's friend, and urge the king
To do me this last right.

 I thank you, honest lord. Remember me
In all humility unto his highness:
Say his long trouble now is passing
Out of this world; tell him, in death I bless'd him,
For so I will. Mine eyes grow dim. Farewell,
My lord. Griffith, farewell. Nay, Patience,
You must not leave me yet: I must to bed;
Call in more women. When I am dead, good wench,
Let me be used with honour: strew me over
With maiden flowers, that all the world may know
I was a chaste wife to my grave: embalm me,
Then lay me forth: although unqueen'd, yet like
A queen, and daughter to a king, inter me.
I can no more.
Exeunt, leading Katharine.
"
