,Key,Name,File,Sex,Cludge,Text
58,gui.,GUIDERIUS,Globe_Shakespeare/cym.xml,1,Globe_Shakespeare/cym.xml-gui.,"         Hail, heaven!

 Out of your proof you speak: we, poor unfledged,
Have never wing'd from view o' the nest, nor know not
What air's from home.   Haply this life is best,
If quiet life be best; sweeter to you
That have a sharper known; well corresponding
With your stiff age: but unto us it is
A cell of ignorance; travelling a-bed;
A prison for a debtor, that not dares
To stride a limit.

 Uncertain favor!

 I am thoroughly weary.

 There is cold meat i' the cave: we'll browse on that,
Whilst what we have kill'd be cook'd.

 What's the matter, sir?

 Money, youth?

 Were you a woman, youth,
I should woo hard but be your groom.   In honesty,
I bid for you as I'ld buy.

 Would I could free't!

 Pray, draw near.

 Go you to hunting; I'll abide with him.

 I love thee; I have spoke it:
How much the quantity, the weight as much,
As I do love my father.

 I could not stir him:
He said he was gentle, but unfortunate;
Dishonestly afflicted, but yet honest.

 But his neat cookery! he cut our roots
In characters,
And sauced our broths, as Juno had been sick
And he her dieter.

 I do note
That grief and patience, rooted in him both,
Mingle their spurs together.

 He is but one: you and my brother search
What companies are near: pray you, away;
Let me alone with him.
[Exeunt Belarius and Arviragus.
 A thing
More slavish did I ne'er than answering
A slave without a knock.

 To who? to thee?   What art thou? Have not I
An arm as big as thine? a heart as big?
Thy words, I grant, are bigger, for I wear not
My dagger in my mouth. Say what thou art.
Why I should yield to thee?

 No, nor thy tailor, rascal,
Who is thy grandfather: he made those clothes,
Which, as it seems, make thee.

 Hence, then, and thank
The man that gave them thee. Thou art some fool;
I am loath to beat thee.

 What's thy name?

 Cloten, thou double villain, be thy name,
I cannot tremble at it: were it Toad, or Adder, Spider,
'Twould move me sooner.

 I am sorry for't; not seeming
So worthy as thy birth.

 Those that I reverence those I fear, the wise:
At fools I laugh, not fear them.

 This Cloten was a fool, an empty purse;
There was no money in 't: not Hercules
Could have knock'd out his brains, for he had none:
Yet I not doing this, the fool had borne
My head as I do his.

 I am perfect what: cut off one Cloten's head,
Son to the queen, after his own report;
Who call'd me traitor, mountaineer, and swore
With his own single hand he'ld take us in,
Displace our heads where--thank the gods!-- they grow,
And set them on Lud's-town.

 Why, worthy father, what have we to lose,
But that he swore to take, our lives?   The law
Protects not us: then why should we be tender
To let an arrogant piece of flesh threat us,
Play judge and executioner all himself,
For we do fear the law?   What company
Discover you abroad?

 With his own sword,
Which he did wave against my throat, I have ta'en
His head from him: I'll throw't into the creek
Behind our rock; and let it to the sea,
And tell the fishes he's the queen's son, Cloten:
That's all I reck.
[Exit.
 Where's my brother?
I have sent Cloten's clotpoll down the stream,
In embassy to his mother: his body's hostage
For his return.  [Solemn music.
 Is he at home?

 What does he mean? since death of my dear'st mother
It did not speak before. All solemn things
Should answer solemn accidents. The matter?
Triumphs for nothing and lamenting toys
Is jollity for apes and grief for boys.
Is Cadwal mad?

 O sweetest, fairest lily!
My brother wears thee not the one half so well
As when they grew'st thyself.

                 Where?

 Why, he but sleeps:
If he be gone, he'll make his grave a bed;
With female fairies will his tomb be haunted,
And worms will not come to thee.

 Prithee, have done;
And do not play in wench-like words with that
Which is so serious. Let us bury him,
And not protract with admiration what
Is now due debt. To the grave!

 By good Euriphile, our mother.

 Cadwal,
I cannot sing: I'll weep, and word it with thee;
For notes of sorrow out of tune are worse
Than priests and fanes that lie.

 Pray you, fetch him hither.
Thersites' body is as good as Ajax',
When neither are alive.

 Nay, Cadwal, we must lay his head to the east;
My father hath a reason for't.

 Come on then, and remove him.

 Fear no more the heat o' the sun,
 Nor the furious winter's rages;
Thou thy worldly task hast done,
 Home art gone, and ta'en thy wages:""
Golden lads and girls all must,
As chimney-sweepers, come to dust.

 Fear no more the lightning-flash,

 Fear not slander, censure rash;

 No exorciser harm thee!

 Ghost unlaid forbear thee!

 We have done our obsequies: come, lay him down.

 The noise is round about us.

 Nay, what hope
Have we in hiding us?   This way, the Romans
Must or for Britons slay us, or receive us
For barbarous and unnatural revolts
During their use, and slay us after.

 This is, sir, a doubt
In such a time nothing becoming you,
Nor satisfying us.

 Than be so
Better to cease to be. Pray, sir, to the army:
I and my brother are not known; yourself
So out of thought, and thereto so o'ergrown,
Cannot be question'd.

 By heavens, I'll go:
If you will bless me, sir, and give me leave,
I'll take the better care, but if you will not,
The hazard therefore due fall on me by
The hands of Romans!

 The same dead thing alive.

 But we saw him dead.

 This is, sure, Fidele.

 Let me end the story:
I slew him there.

 I have spoke it, and I did it.

 A most incivil one: the wrongs he did me
Were nothing prince-like; for he did provoke me
With language that would make me spurn the sea,
If it could so roar to me: I cut off's head;
And am right glad he is not standing here
To tell this tale of mine.

 And our good his.

 And at first meeting loved;
Continued so, until we thought he died.

"
59,adam.,ADAM,Globe_Shakespeare/ayl.xml,1,Globe_Shakespeare/ayl.xml-adam.,"    What, my young master? O my gentle master!
O my sweet master! O you memory
Of old Sir Rowland! why, what make you here?
Why are you virtuous? why do people love you?
And wherefore are you gentle, strong and valiant?
Why would you be so fond to overcome
The bonny priser of the humorous duke?
Your praise is come too swiftly home before you.
Know you not, master, to some kind of men
Their graces serve them but as enemies?
No more do yours: your virtues, gentle master,
Are sanctified and holy traitors to you.
O, what a world is this, when what is comely
Envenoms him that bears it!

 O unhappy youth!
Come not within these doors; within this roof
The enemy of all your graces lives:
Your brother--no, no brother; yet the son--
Yet not the son, I will not call him son
Of him I was about to call his father--
Hath heard your praises, and this night he means
To burn the lodging where you use to lie
And you within it: if he fail of that,
He will have other means to cut you off.
I overheard him and his practices.
This is no place; this house is but a butchery:
Abhor it, fear it, do not enter it.

 No matter whither, so you come not here.

 But do not so. I have five hundred crowns,
The thrifty hire I saved under your father,
Which I did store to be my foster-nurse
When service should in my old limbs lie lame
And unregarded age in corners thrown:
Take that, and He that doth the ravens feed,
Yea, providently caters for the sparrow,
Be comfort to my age! Here is the gold;
And all this I give you. Let me be your servant:
Though I look old, yet I am strong and lusty;
For in my youth I never did apply
Hot and rebellious liquors in my blood,
Nor did not with unbashful forehead woo
The means of weakness and debility;
Therefore my age is as a lusty winter,
Frosty, but kindly: let me go with you;
I'll do the service of a younger man
In all your business and necessities.

 Master, go on, and I will follow thee,
To the last gasp, with truth and loyalty.
From seventeen years till now almost fourscore
Here lived I, but now live here no more.
At seventeen years many their fortunes seek;
But at fourscore it is too late a week:
Yet fortune cannot recompense me better
Than to die well and not my master's debtor.
                            [Exeunt.  So had you need:
I scarce can speak to thank you for myself.

"
60,hel.,Helicanus,Globe_Shakespeare/per.xml,1,Globe_Shakespeare/per.xml-hel.," Peace, peace, and give experience tongue.
They do abuse the king that flatter him:
For flattery is the bellows blows up sin;
The thing the which is flatter'd, but a spark, 
To which that blast gives heat and stronger
 glowing;
Whereas reproof, obedient and in order,
Fits kings, as they are men, for they may err.
When Signior Sooth here does proclaim a peace,
He flatters you, makes war upon your life.
Prince, pardon me, or strike me, if you please;
I cannot be much lower than my knees. An angry brow, dread lord. How dare the plants look up to heaven, from whence
They have their nourishment? I have ground the axe myself;
Do you but strike the blow. To bear with patience
Such griefs as you yourself do lay upon yourself.           Alas, sir! Well, my lord, since you have given me leave to speak,
Freely will I speak. Antiochus you fear,
And justly too, I think, you fear the tyrant,
Who either by public war or private treason
Will take away your life.
Therefore, my lord, go travel for a while,
Till that his rage and anger be forgot,
Or till the Destinies do cut his thread of life.
Your rule direct to any; if to me,
Day serves not light more faithful than I'll be. We'll mingle our bloods together in the earth,
From whence we had our being and our birth. You shall not need, my fellow peers
 of Tyre,
Further to question me of your king's departure:
His seal'd commission, left in trust with me,
Doth speak sufficiently he's gone to travel. If further yet you will be satisfied,
Why, as it were unlicensed of your loves,
He would depart, I'll give some light unto you.
Being at Antioch-- Royal Antiochus--on what cause I know not--     
Took some displeasure at him; at least he     judged so: 
And doubting lest that he had err'd or sinn'd,
To show his sorrow, he'ld correct himself;
So puts himself unto the shipman's toil,
With whom each minute threatens life or death. Lord Thaliard from Antiochus is welcome. We have no reason to desire it,
Commended to our master, not to us:
Yet, ere you shall depart, this we desire, 
As friends to Antioch, we may feast in Tyre.
[Exeunt No, Escanes, know this of me,
Antiochus from incest lived not free:
For which, the most high gods not minding longer
To withhold the vengeance that they had in store,
Due to this heinous capital offence,
Even in the height and pride of all his glory,
When he was seated in a chariot
Of an inestimable value, and his daughter with him,
A fire from heaven came and shrivell'd up
Their bodies, even to loathing; for they so stunk, 
That all those eyes adored them ere their fall
Scorn now their hand should give them burial. And yet but justice; for though
This king were great, his greatness was no guard
To bar heaven's shaft, but sin had his reward. With me? and welcome: happy day, my lords. Your griefs! for what? wrong not your prince you love. For honor's cause, forbear your suffrages:
If that you love Prince Pericles, forbear.
Take I your wish, I leap into the seas,
Where's hourly trouble for a minute's ease.
A twelve month longer, let me entreat you to
Forbear the absence of your king;
If in which time expired, he not return,
I shall with aged patience bear your yoke.
But if I cannot win you to this love,
Go search like nobles, like noble subjects, 
And in your search spend your adventurous worth;
Whom if you find, and win unto return,
You shall like diamonds sit about his crown. Then you love us, we you, and we'll clasp hands:
When peers thus knit, a kingdom ever stands.
[Exeunt. That he have his. Call up some gentlemen. Gentlemen, there's some of worth would come aboard;
I pray ye, greet them fairly.                 
The Gentlemen and the two Sailors descend, and go on board the barge.
Enter, from thence, LYSIMACHUS and Lords;
   with the Gentlemen and the two Sailors.  And you, sir, to outlive the age I am,
And die as I would do. First, what is your place?           Sir,
Our vessel is of Tyre, in it the king;
A man who for this three months hath not spoken
To any one, nor taken sustenance
But to prorogue his grief. 'Twould be too tedious to repeat;
But the main grief springs from the loss
Of a beloved daughter and a wife.          You may;
But bootless is your sight: he will not speak
To any. Behold him.   Pericles discovered.
This was a goodly person,
Till the disaster that, one mortal night,
Drove him to this. It is in vain; he will not speak to you. Sure, all's effectless; yet nothing we'll omit
That bears recovery's name. But, since your kindness
We have stretch'd thus far, let us beseech you
That for our gold we may provision have,
Wherein we are not destitute for want,
But weary for the staleness. Sit, sir, I will recount it to you:
But, see, I am prevented.
Re-enter, from the barge, Lord, with MARINA and a young Lady. She's a gallant lady. Calls my lord? I know not; but
Here is the regent, sir, of Mytilene
Speaks nobly of her. Sir, 'tis the governor of Mytilene,
Who, hearing of your melancholy state,
Did come to see you. My lord, I hear none. Sir? Hail, madam, and my queen!"
61,lov.,SIR THOMAS LOVELL,Globe_Shakespeare/h8.xml,1,Globe_Shakespeare/h8.xml-lov.," Faith, my lord,
I hear of none, but the new proclamation
That's clapp'd upon the court-gate.

 The reformation of our travell'd gallants,
That fill the court with quarrels, talk, and tailors.

 They must either,
For so run the conditions, leave those remnants
Of fool and feather that they got in France,
With all their honourable points of ignorance
Pertaining thereunto, as fights and fireworks,
Abusing better men than they can be,
Out of a foreign wisdom, renouncing clean
The faith they have in tennis, and tall stockings,
Short blister'd breeches, and those types of travel,
And understand again like honest men;
Or pack to their old playfellows: there, I take it,
They may, 'cum privilegio,' wear away
The lag end of their lewdness and be laugh'd at.

 Ay, marry,
There will be woe indeed, lords: the sly whoresons
Have got a speeding trick to lay down ladies;
A French song and a fiddle has no fellow.

 To the cardinal's:
Your lordship is a guest too.

 That churchman bears a bounteous mind indeed,
A hand as fruitful as the land that feeds us;
His dews fall every where.

 O, that your lordship were but now confessor
To one or two of these!

 Faith, how easy?

 Yes, my lord.

 I do beseech your grace, for charity,
If ever any malice in your heart
Were hid against me, now to forgive me frankly.

 To the water side I must conduct your grace;
Then give my charge up to Sir Nicholas Vaux,
Who undertakes you to your end.

 Came you from the king, my lord?

 I must to him too,
Before he go to bed. I'll take my leave.

 My lord, I love you;
And durst commend a secret to your ear
Much weightier than this work. The queen's in labour,
They say, in great extremity; and fear'd
She'll with the labour end.

 Methinks I could
Cry the amen; and yet my conscience says
She's a good creature, and, sweet lady, does
Deserve our better wishes.

 Now, sir, you speak of two
The most remark'd i' the kingdom. As for Cromwell,
Beside that of the jewel house, is made master
O' the rolls, and the king's secretary; further, sir,
Stands in lte gap and trade of moe preferments,
With which the time will load him.   The archbishop
Is the king's hand and tongue'; and who dare speak
One syllable against him?

 Many good nights, my lord: I rest your servant.
Exeunt Gardiner and Page. 
Enter the KING and SUFFOLK. 
 I could not personally deliver to her
What you commanded me, but by her woman
I sent your message; who return'd her thanks
In the greatest humbleness, and desired your highness
Most heartily to pray for her.

 So said her woman; and that her sufferance made
Almost each pang a death.

 This is about that which the bishop spake:
I am happily come hither.
Re-enter DENNY, with CRANMER.
 Sir?

"
