,Key,Name,File,Sex,Cludge,Text
91,pand.,CARDINAL PANDULPH,Globe_Shakespeare/jn.xml,1,Globe_Shakespeare/jn.xml-pand.," Hail, you anointed deputies of heaven!
To thee, King John, my holy errand is.
I Pandulph, of fair Milan cardinal,
And from Pope Innocent the legate here,
Do in his name religiously demand
Why thou against the church, our holy mother,
So wilfully dost spurn; and force perforce
Keep Stephen Langton, chosen archbishop
Of Canterbury, from that holy see?
This, in our aforesaid holy father's name,
Pope Innocent, I do demand of thee.

 Then, by the lawful power that I have,
Thou shalt stand cursed and excommunicate:
And blessed shall he be that doth revolt
From his allegiance to an heretic;
And meritorious shall that hand be call'd,
Canonized and worshipp'd as a saint,
That takes away by any secret course
Thy hateful life.

 There's law and warrant, lady, for my curse.

 Philip of France, on peril of a curse,
Let go the hand of that arch-heretic;
And raise the power of France upon his head,
Unless he do submit himself to Rome.

 What canst thou say but will perplex thee more,
If thou stand excommunicate and cursed?

 All form is formless, order orderless,
Save what is opposite to England's love.
Therefore to arms! be champion of our church,
Or let the church, our mother, breathe her curse,
A mother's curse, on her revolting son.
France, thou mayst hold a serpent by the tongue,
A chafed lion by the mortal paw,
A fasting tiger safer by the tooth,
Than keep in peace that hand which thou dost hold.

 So makest thou faith an enemy to faith;
And like a civil war set'st oath to oath,
Thy tongue against thy tongue. O, let thy vow
First made to heaven, first be to heaven perform'd,
That is, to be the champion of our church!
What since thou sworest is sworn against thyself
And may not be performed by thyself,
For that which thou hast sworn to do amiss
Is not amiss when it is truly done,
And being not done, where doing tends to ill,
The truth is then most done not doing it:
The better act of purposes mistook
Is to mistake again; though indirect,
Yet indirection thereby grows direct,
And falsehood falsehood cures, as fire cools fire
Within the scorched veins of one new-burn'd.
It is a religion that doth make vows kept;
But thou hast sworn against religion,
But what thou swear'st against the thing thou swear'st,
And makest an oath the surety for thy truth
Against an oath: the truth thou art unsure
To swear, swears only not to be forsworn;
Else what a mockery should it be to swear!
But thou dost swear only to be forsworn;
And most forsworn, to keep what thou dost swear.
Therefore thy later vows against thy first
Is in thyself rebellion to thyself;
And better conquest never canst thou make
Than arm thy constant and thy nobler parts
Against these giddy loose suggestions:
Upon which better part our prayers come in,
If thou vouchsafe them. But if not, then know
The peril of our course light on thee
So heavy as thou shalt not shake them off,
But in despair die under their black weight.

 I will denounce a curse upon his head.

 Courage and comfort all shall yet go well.

 Lady, you utter madness, and not sorrow.

 You hold too heinous a respect of grief.

 Before the curing of a strong disease,
Even in the instant of repair and health,
The fit is strongest; evils that take leave,
On their departure most of all show evil:
What have you lost by losing of this day?

 If you had won it, certainly you had.
No, no; when Fortune means to men most good,
She looks upon them with a threatening eye.
'Tis strange to think how much King John hath lost
In this which he accounts so clearly won:
Are not you grieved that Arthur is his prisoner?

 Your mind is all as youthful as your blood.
Now hear me speak with a prophetic spirit;
For even the breath of what I mean to speak
Shall blow each dust, each straw, each little rub,
Out of the path which shall directly lead
Thy foot to England's throne; and therefore mark.
John hath seized Arthur; and it cannot be
That, whiles warm life plays in that infant's veins,
The misplaced John should entertain an hour
One minute, nay, one quiet breath of rest.
A sceptre snatch'd with an unruly hand
Must be as boisterously maintain'd as gain'd;
And he that stands upon a slippery place
Makes nice of no vile hold to stay him up:
That John may stand, then Arthur needs must fall;
So be it, for it cannot be but so.

 You, in the right of Lady Blanch your wife,
May then make all the claim that Arthur did.

 How green you are and fresh in this old world!
John lays you plots; the times conspire with you;
For he that steeps his safety in true blood
Shall find but bloody safety and untrue.
This act so evilly born shall cool the hearts
Of all his people and freeze up their zeal,
That none so small advantage shall step forth
To check his reign, but they will cherish it;
No natural exhalation in the sky,
No scope of nature, no distemper'd day,
No common wind, no customed event,
But they will pluck away his natural cause
And call them meteors, prodigies and signs,
Abortives, presages and tongues of heaven,
Plainly denouncing vengeance upon John.

 O, sir, when he shall hear of your approach,
If that young Arthur be not gone already,
Even at that news he dies; and then the hearts
Of all his people shall revolt from him
And kiss the lips of unacquainted change
And pick strong matter of revolt and wrath
Out of the bloody fingers' ends of John.
Methinks I see this hurly all on foot:
And, O, what better matter breeds for you
Than I have named!  The bastard Faulconbridge
Is now in England, ransacking the church,
Offending charity: if but a dozen French
Were there in arms, they would be as a call
To train ten thousand English to their s'de,
Or as a little snow, tumbled about,
Anon becomes a mountain. O noble Dauphin,
Go with me to the king: 'tis wonderful
What may be wrought out of their discontent,
Now that their souls are topfull of offence.
For England go: I will whet on the king.

 Take again
>From this my hand, as holding of the pope

Your sovereign greatness and authority.

 It was my breath that blew this tempest up,
Upon your stubborn usage of the pope;
But since you are a gentle convertite,
My tongue shall hush again this storm of war
And make fair weather in your blustering land.
On this Ascension-day, remember well,
Upon your oath of service to the pope,
Go I to make the French lay down their arms.
                           [Exit.
 Hail, noble prince of France!
The next is this, King John hath reconciled
Himself to Rome; his spirit is come in,
That so stood out against the holy church,
The great metropolis and see of Rome:
Therefore thy threatening colors now wind up;
And tame the savage spirit of wild war,
That, like a lion foster'd up at hand,
It may lie gently at the foot of peace,
And be no further harmful than in show.

 You look but on the outside of this work.

 The Dauphin is too wilful-opposite,
And will not temporize with my entreaties;
He flatly says he 'll not lay down his arms.

 Give me leave to speak.

"
92,shy.,SHYLOCK,Globe_Shakespeare/mv.xml,1,Globe_Shakespeare/mv.xml-shy.,"         How like a fawning publican he looks!
I hate him for he is a Christian,
But more for that in low simplicity
He lends out money gratis and brings down
The rate of usance here with us in Venice.
If I can catch him once upon the hip,
I will feed fat the ancient grudge I bear him.
He hates our sacred nation, and he rails,
Even there where merchants most do congregate,
On me, my bargains and my well-won thrift,
Which he calls interest. Cursed be my tribe,
If I forgive him!

 I am debating of my present store,
And, by the near guess of my memory,
I cannot instantly raise up the gross
Of full three thousand ducats. What of that?
Tubal, a wealthy Hebrew of my tribe,
Will furnish me. But soft! how many months
Do you desire?  [To Ant.] Rest you fair, good signior;
Your worship was the last man in our mouths.

 Ay, ay, three thousand ducats.

 I had forgot; three months; you told me so.
Well then, your bond; and let me see; but hear you;
Methought you said you neither lend nor borrow
Upon advantage.

 When Jacob grazed his uncle Laban's sheep--
This Jacob from our holy Abram was,
As his wise mother wrought in his behalf,
The third possessor; ay, he was the third--

 No, not take interest, not, as you would say,
Directly interest: mark what Jacob did.
When Laban and himself were compromised
That all the eanlings which were streak'd and pied
Should fall as Jacob's hire, the ewes, being rank,
In the end of autumn turned to the rams,
And, when the work of generation was
Between these woolly breeders in the act,
The skilful shepherd peel'd me certain wands
And, in the doing of the deed of kind,
He stuck them up before the fulsome ewes,
Who then conceiving did in eaning time
Fall parti-color'd lambs, and those were Jacob's.
This was a way to thrive, and he was blest:
And thrift is blessing, if men steal it not.

 I cannot tell; I make it breed as fast:
But note me, signior.

 Three thousand ducats; 'tis a good round sum.
Three months from twelve; then, let me see; the rate--

 Signior Antonio, many a time and oft
In the Rialto you have rated me
About my moneys and my usances:
Still have I borne it with a patient shrug,
For sufferance is the badge of all our tribe.
You call me misbeliever, cut-throat dog,
And spit upon my Jewish gaberdine,
And all for use of that which is mine own.
Well then, it now appears you need my help:
Go to, then; you come to me, and you say
'Shylock, we would have moneys:' you say so;
You, that did void your rheum upon my beard
And foot me as you spurn a stranger cur
Over your threshold: moneys is your suit.
What should I say to you? Should I not say
'Hath a dog money? is it possible
A cur can lend three thousand ducats?' Or
Shall I bend low and in a bondman's key,
With bated breath and whispering humbleness,
Say this;
'Fair sir, you spit on me on Wednesday last;
You spurn'd me such a day; another time
You call'd me dog; and for these courtesies
I'll lend you thus much moneys'?

 Why, look you, how you storm!
I would be friends with you and have your love,
Forget the shames that you have stain'd me with,
Supply your present wants and take no doit
Of usance for my moneys, and you'll not hear me:
This is kind I offer.

 This kindness will I show.
Go with me to a notary, seal me there
Your single bond; and, in a merry sport,
If you repay me not on such a day,
In such a place, such sum or sums as are
Express'd in the condition, let the forfeit
Be nominated for an equal pound
Of your fair flesh, to be cut off and taken
In what part of your body pleaseth me.

 O father Abram, what these Christians are,
Whose own hard dealings teaches them suspect
The thoughts of others! Pray you, tell me this;
If he should break his day, what should I gain
By the exaction of the forfeiture?
A pound of man's flesh taken from a man
Is not so estimable, profitable neither,
As flesh of muttons, beefs, or goats.   I say,
To buy his favor, I extend this friendship:
If he will take it, so; if not, adieu;
And, for my love, I pray you wrong me not.

 Then meet me forthwith at the notary's;
Give him direction for this merry bond,
And I will go and purse the ducats straight,
See to my house, left in the fearful guard
Of an unthrifty knave, and presently
I will be with you.

 Well, thou shalt see, thy eyes shall be thy judge,
The difference of old Shylock and Bassanio:--
What, Jessica!--thou shalt not gormandise,
As thou hast done with me: What, Jessica!--
And sleep and snore, and rend apparel out;--
Why, Jessica, I say!

 Who bids thee call?   I do not bid thee call.

 I am bid forth to supper, Jessica:
There are my keys. But wherefore should I go?
I am not bid for love; they flatter me:
But yet I'll go in hate, to feed upon
The prodigal Christian. Jessica, my girl,
Look to my house. I am right loath to go:
There is some ill a-brewing towards my rest,
For I did dream of money-bags to-night.

 So do I his.

 What, are there masques? Hear you me, Jessica:
Lock up my doors; and when you hear the drum
And the vile squealing of the wry-neck'd fife,
Clamber not you up to the casements then,
Nor thrust your head into the public street
To gaze on Christian fools with varnish'd faces,
But stop my house's ears, I mean my casements:
Let not the sound of shallow foppery enter
My sober house. By Jacob's staff, I swear,
I have no mind of feasting forth to-night:
But I will go. Go you before me, sirrah;
Say I will come.

 What says that fool of Hagar's offspring, ha?

 The patch is kind enough, but a huge feeder;
Snail-slow in profit, and he sleeps by day
More than the wild-cat; drones hive not with me;
Therefore I part with him, and part with him
To one that I would have him help to waste
His borrow'd purse. Well, Jessica, go in;
Perhaps I will return immediately:
Do as I bid you; shut doors after you:
Fast bind, fast find;
A proverb never stale in thrifty mind. [Exit.
  She is damned for it.

 My own flesh and blood to rebel!

 I say, my daughter is my flesh and blood.

     What, what, what? ill luck, ill luck?

       Gaoler, look to him: tell not me of mercy;
This is the fool that lent out money gratis:
Gaoler, look to him.

 I'll have my bond; speak not against my bond:
I have sworn an oath that I will have my bond.
Thou call'dst me dog before thou hadst a cause;
But, since I am a dog, beware my fangs:
The duke shall grant me justice. I do wonder,
Thou naughty gaoler, that thou art so fond
To come abroad with him at his request.

 I'll have my bond; I will not hear thee speak:
I'll have my bond; and therefore speak no more.
I'll not be made a soft and dull-eyed fool,
To shake the head, relent, and sigh, and yield
To Christian inercessors. Follow not;
I'll have no speaking: I will have my bond.
[Exit.
 I have possess'd your grace of what I purpose;
And by our holy Sabbath have I sworn
To have the due and forfeit of my bond:
If you deny it, let the danger light
Upon your charter and your city's freedom.
You'll ask me, why I rather choose to have
A weight of carrion flesh than to receive
Three thousand ducats: I'll not answer that:
But, say, it is my humor: is it answer'd?
What if my house be troubled with a rat
And I be pleased to give ten thousand ducats
To have it baned?   What, are you answer'd yet?
Some men there are love not a gaping pig;
Some, that are mad if they behold a cat;
And others, when the bagpipe sings i' the nose,
Cannot contain their urine: for affection,
Mistress of passion, sways it to the mood
Of what it likes or loathes. Now, for your answer:
As there is no firm reason to be render'd,
Why he cannot abide a gaping pig;
Why he, a harmless necessary cat;
Why he, a woollen bagpipe; but of force
Must yield to such inevitable shame
As to offend, himself being offended;
So can I give no reason, nor I will not,
More than a lodged hate and a certain loathing
I bear Antonio, that I follow thus
A losing suit against him. Are you answer'd?

 I am not bound to please thee with my answers.

 Hates any man the thing he would not kill?

 What, wouldst thou have a serpent sting thee twice?

 If every ducat in six thousand ducats
Were in six parts and every part a ducat,
I would not draw them; I would have my bond.

 What judgement shall I dread, doing no wrong?
You have among you many a purchased slave,
Which, like your asses and your dogs and mules,
You use in abject and in slavish parts,
Because you bought them: shall I say to you,
Let them be free, marry them to your heirs?
Why sweat they under burthens? let their beds
Be made as soft as yours and let their palates
Be season'd with such viands?   You will answer
'The slaves are ours:' so do I answer you:
The pound of flesh, which I demand of him,
Is dearly bought; 'tis mine and I will have it.
If you deny me, fie upon your law!
There is no force in the decrees of Venice.
I stand for judgement: answer; shall I have it?

 To cut the forfeiture from that bankrupt there.

 No, none that thou hast wit enough to make.

 Till thou canst rail the seal from off my bond,
Thou but offend'st thy lungs to speak so loud:
Repair thy wit, good youth, or it will fall
To cureless ruin.   I stand here for law.

 Shylock is my name.

 On what compulsion must I? tell me that.

 My deeds upon my head!   I crave the law,
The penalty and forfeit of my bond.

 A Daniel come to judgement! yea, a Daniel!
O wise young judge, how I do honor thee!

 Here 'tis, most reverend doctor, here it is.

 An oath, an oath, I have an oath in heaven:
Shall I lay perjury upon my soul?
No, not, for Venice.

 When it is paid according to the tenor.
It doth appear you are a worthy judge;
You know the law, your exposition
Hath been most sound: I charge you by the law,
Whereof you are a well-deserving pillar,
Proceed to judgement: by my soul I swear
There is no power in the tongue of man
To alter me: I stay here on my bond.

 O noble judge!   O excellent young man!

 'Tis very true: O wise and upright judge!
How much more elder art thou than thy looks!

 Ay, his breast:
So says the bond: doth it not, noble judge?
'Nearest his heart:' those are the very words.

 I have them ready.

 Is it so nominated in the bond?

 I cannot find it; 'tis not in the bond.

 These be the Christian husbands.   I have a daughter;
Would any of the stock of Barrabas
Had been her husband rather than a Christian! [Aside.
We trifle time: I pray thee, pursue sentence.

 Most rightful judge!

 Most learned judge!   A sentence! Come, prepare!

 Is that the law?

 I take this offer, then; pay the bond thrice
And let the Christian go.

 Give me my principal, and let me go.

 Shall I not have barely my principal?

 Why, then the devil give him good of it!
I'll stay no longer question.

 Nay, take my life and all; pardon not that:
You take my house when you do take the prop
That doth sustain my house; you take my life
When you do take the means whereby I live.

 I am content.

 I pray you, give me leave to go from hence;
I am not well: send the deed after me,
And I will sign it.

"
