,Key,Name,File,Sex,Cludge,Text
0,tgv-5,JULIA,Globe_Shakespeare/tgv.xml,0,Globe_Shakespeare/tgv.xml-tgv-5," But say, Lucetta, now we are alone,
Wouldst thou then counsel me to fall in love?

 Of all the fair resort of gentlemen
That every day with parle encounter me,
In thy opinion which is worthiest love?

 What think'st thou of the fair Sir Eglamour?

 What think'st thou of the rich Mercatio?

 What think'st thou of the gentle Proteus?

 How now! what means this passion
at his name?

 Why not on Proteus, as of all the rest?

 Your reason?

 And wouldst thou have me cast my love on him?

 Why he, of all the rest, hath never moved me.

 His little speaking shows his love but small.

 They do not love that do not show their love.

 I would I knew his mind.

 'To Julia.' Say, from whom?

 Say, say, who gave it thee?

 Now, by my modesty, a goodly broker!
Dare you presume to harbor wanton lines?
To whisper and conspire against my youth?
Now, trust me, 'tis an office of great worth
And you an officer fit for the place.
There, take the paper: see it be return'd;
Or else return no more into my sight.

 Will ye be gone?

 And yet I would I had overlooked the letter:
It were a shame to call her back again
And pray her to a fault for which I chid her.
What a fool is she, that knows I am a maid,
And would not force the letter to my view!
Since maids, in modesty, say 'no' to that
Which they would have the profferer construe 'ay.'
Fie, fie, how wayward is this foolish love
That, like a testy babe, will scratch the nurse
And presently all humbled kiss the rod!
How churlishly I chid Lucetta hence,
When willingly I would have had her here!
How angerly I taught my brow to frown,
When inward joy enforced my heart to smile!
My penance is to call Lucetta back
And ask remission for my folly past.
What ho! Lucetta!
Re-enter LUCETTA.
 Is't near dinner-time?

 What is't that you took up so gingerly?

 Why didst thou stoop, then?

 And is that paper nothing?

 Then let it lie for those that it concerns.

 Some love of yours hath writ to you in rhyme.

 As little by such toys as may be possible.
Best sing it to the tune of 'Light o' love.'

 Heavy! belike it hath some burden then?

 And why not you?

 Let's see your song. How now, minion!

 You do not?

 You, minion, are too saucy.

 The mean is drown'd with your unruly bass.

 This babble shall not henceforth trouble me.
Here is a coil with protestation!
                   [Tears the letter.
Go get you gone, and let the papers lie:
You would be fingering them, to anger me.

 Nay, would I were so anger'd with the same!
O hateful hands, to tear such loving words!
Injurious wasps, to feed on such sweet honey
And kill the bees that yield it with your stings!
I'll kiss each several paper for amends.
Look, here is writ 'kind Julia.' Unkind Julia!
As in revenge of thy ingratitude,
I throw thy name against the bruising stones,
Trampling contemptuously on thy disdain.
And here is writ 'love-wounded Proteus.'
Poor wounded name! my bosom as a bed
Shall lodge thee till thy wound be throughly heal'd;
And thus I search it with a sovereign kiss.
But twice or thrice was 'Proteus' written down.
Be calm, good wind, blow not a word away
Till I have found each letter in the letter,
Except mine own name: that some whirlwind bear
Unto a ragged fearful-hanging rock
And throw it thence into the raging sea!
Lo, here in one line is his name twice writ,
'Poor forlorn Proteus, passionate Proteus,
To the sweet Julia:' that I'll tear away.
And yet I will not, sith so prettily
He couples it to his complaining names.
Thus will I fold them one upon another:
Now kiss, embrace, contend, do what you will.

Re-enter LUCETTA.
 Well, let us go.

 If you respect them, best to take them up.

 I see you have a month's mind to them.

 Come, come; will't please you go?
                   [Exeunt. I must, where is no remedy.

 If you turn not, you will return the sooner.
Keep this remembrance for thy Julia's sake.
                                  [Giving a ring.
 And seal the bargain with a holy kiss.

 Counsel, Lucetta; gentle girl, assist me;
And even in kind love I do conjure thee,
Who art the table wherein all my thoughts
Are visibly character'd and engraved,
To lesson me and tell me some good mean
How, with my honour, I may undertake
A journey to my loving Proteus.

 A true-devoted pilgrim is not weary
To measure kingdoms with his feeble steps;
Much less shall she that hath Love's wings to fly,
And when the flight is made to one so dear,
Of such divine perfection, as Sir Proteus.

 O, know'st thou not his looks are my soul's food?
Pity the dearth that I have pined in,
By longing for that food so long a time.
Didst thou but know the inly touch of love,
Thou wouldst as soon go kindle fire with snow
As seek to quench the fire of love with words.

 The more thou damm'st it up, the more it burns.
The current that with gentle murmur glides,
Thou know'st, being stopp'd, impatiently doth rage;
But when his fair course is not hindered,
He makes sweet music with the enamell'd stones,
Giving a gentle kiss to every sedge
He overtaketh in his pilgrimage,
And so by many winding nooks he strays
With willing sport to the wild ocean.
Then let me go and hinder not my course:
I'll be as patient as a gentle stream
And make a pastime of each weary step,
Till the last step have brought me to my love;
And there I'll rest, as after much turmoil
A blessed soul doth in Elysium.

 Not like a woman; for I would prevent
The loose encounters of lascivious men:
Gentle Lucetta, fit me with such weeds
As may beseem some well-reputed page.

 No, girl; I'll knit it up in silken strings
With twenty odd-conceited true-love knots.
To be fantastic may become a youth
Of greater time than I shall show to be.

 That fits as well as 'Tell me, good my lord,
What compass will you wear your farthingale?'
Why even what fashion thou best likest, Lucetta.

 Out, out, Lucetta! that will be ill-favor'd.

 Lucetta, as thou lovest me, let me have
What thou thinkest meet and is most mannerly.
But tell me, wench, how will the world repute me
For undertaking so unstaid a journey?
I fear me, it will make me scandalized.

 Nay, that I will not.

 That is the least, Lucetta, of my fear:
A thousand oaths, an ocean of his tears
And instances of infinite of love
Warrant me welcome to my Proteus.

 Base men, that use them to so base effect!
But truer stars did govern Proteus' birth;
His words are bonds, his oaths are oracles,
His love sincere, his thoughts immaculate,
His tears pure messengers sent from his heart,
His heart as far from fraud as heaven from earth.

 Now, as thou lovest me, do him not that wrong
To bear a hard opinion of his truth:
Only deserve my love by loving him;
And presently go with me to my chamber,
To take a note of what I stand in need of,
To furnish me upon my longing journey.
All that is mine I leave at thy dispose,
My goods, my lands, my reputation;
Only, in lieu thereof, dispatch me hence.
Come, answer not, but to it presently!
I am impatient of my tarriance.
[Exeunt. 
           I would always have one play but one thing.
But, host, doth this Sir Proteus that we talk on
Often resort unto this gentlewoman?

  Peace! stand aside: the company parts.

 'Twere false, if I should speak it;
For I am sure she is not buried.

 He heard not that.

 If 'twere a substance, you would, sure, deceive it,
And make it but a shadow, as I am.

   Not so; but it hath been the longest night
That e'er I watch'd and the most heaviest.
[Exeunt.
 In what you please: I'll do what I can.

 It seems you loved not her, to leave her token.
She is dead, belike?

 Alas!

 I cannot choose
But pity her.

 Because methinks that she loved you as well
As you do love your lady Silvia:
She dreams on him that has forgot her love;
You dote on her that cares not for your love.
'Tis pity love should be so contrary;
And thinking on it makes me cry 'alas!'

 How many women would do such a message?
Alas, poor Proteus! thou hast entertain'd
A fox to be the shepherd of thy lambs.
Alas, poor fool! why do I pity him
That with his very heart despiseth me?
Because he loves her, he despiseth me;
Because I love him, I must pity him.
This ring I gave him when he parted from me,
To bind him to remember my good will;
And now am I, unhappy messenger,
To plead for that which I would not obtain,
To carry that which I would have refused,
To praise his faith which I would have dispraised.
I am my master's true-confirmed love;
But cannot be true servant to my master,
Unless I prove false traitor to myself.
Yet will I woo for him, but yet so coldly
As, heaven it knows, I would not have him speed.
Enter SILVIA, attended.
Gentlewoman, good day! I pray you, be my mean
To bring me where to speak with Madam Silvia.

 If you be she, I do entreat your patience
To hear me speak the message I am sent on.

 From my master, Sir Proteus, madam.

 Ay, madam.

 Madam, please you peruse this letter.--
Pardon me, madam; I have unadvised
Deliver'd you a paper that I should not:
This is the letter to your ladyship.

 It may not be; good madam, pardon me.

 Madam, he sends your ladyship this ring.

 She thanks you.

 I thank you, madam, that you tender her.
Poor gentlewoman! my master wrongs her much.

 Almost as well as I do know myself:
To think upon her woes I do protest
That I have wept a hundred several times.

 I think she doth; and that's her cause of sorrow.
    She hath been fairer, madam, than she is:
When she did think my master loved her well,
She, in my judgement, was as fair as you;
But since she did neglect her looking-glass
And threw her sun-expelling mask away,
The air hath starved the roses in her cheeks
And pinch'd the lily-tincture of her face,
That now she is become as black as I.

 About my stature; for at Pentecost,
When all our pageants of delight were play'd,
Our youth got me to play the woman's part,
And I was trimm'd in Madam Julia's gown,
Which served me as fit, by all men's judgements,
As if the garment had been made for me:
Therefore I know she is about my height.
And at that time I made her weep agood,
For I did play a lamentable part:
Madam, 'twas Ariadne passioning
For Theseus' perjury and unjust flight;
Which I so lively acted with my tears
That my poor mistress, moved therewithal,
Wept bitterly; and would I might be dead
If I in thought felt not her very sorrow!

 And she shall thank you for't, if e'er you know her.
A virtuous gentlewoman, mild and beautiful!
I hope my master's suit will be but cold,
Since she respects my mistress' love so much,
Alas, how love can trifle with itself!
Here is her picture; let me see; I think,
If I had such a tire, this face of mine
Were full as lovely as is this of hers:
And yet the painter flatter'd her a little,
Unless I flatter with myself too much.
Her hair is auburn, mine is perfect yellow:
If that be all the difference in his love,
I'll get me such a colour'd periwig.
Her eyes are grey as glass, and so are mine:
Ay, but her forehead 's low, and mine's as high,
What should it be that he respects in her
But I can make respective in myself,
If this fond love were not a blinded god?
Come, shadow, come, and take this shadow up,
For 'tis thy rival. O thou senseless form,
Thou shalt be worshipp'd, kiss'd, loved and adored!
And, were there sense in his idolatry,
My substance should be statue in thy stead.
I'll use thee kindly for thy mistress' sake,
That used me so; or else, by Jove I vow,
I should have scratch'd out your unseeing eyes,
To make my master out of love with thee!

Exit.
 But love will not be spurr'd to what it loathes.

 'Tis true; such pearls as put out ladies' eyes;
For I had rather wink than look on them.

 But better, indeed, when you hold your peace.

 She needs not, when she knows it cowardice.

 True; from a gentleman to a fool.

 That such an ass should owe them.

 Here comes the duke.
Enter DUKE.
 And I will follow, more to cross that love
Than hate for Silvia that is gone for love.
[Exit.
 And me, when he approacheth to your presence.

   Here 'tis; this is it.

 O, cry you mercy, sir, I have mistook:
This is the ring you sent to Silvia.

 And Julia herself did give it me;
And Julia herself hath brought it hither.

 Behold her that gave aim to all thy oaths,
And entertain'd 'em deeply in her heart.
How oft hast thou with perjury cleft the root!
O Proteus, let this habit make thee blush!
Be thou ashamed that I have took upon me
Such an immodest raiment, if shame live
In a disguise of love:
It is the lesser blot, modesty finds,
Women to change their shapes than men their minds.

 And I mine.
Enter Outlaws, with DUKE and THURIO.
"
1,tgv-8,SILVIA,Globe_Shakespeare/tgv.xml,0,Globe_Shakespeare/tgv.xml-tgv-8," Sir Valentine and servant, to you
two thousand.
    I thank you, gentle servant: 'tis very
clerkly done.

 Perchance you think too much of so
much pains?

 A pretty period!   Well, I guess the sequel;
And yet I will not name it; and yet I care not;
And yet take this again; and yet I thank you,
Meaning henceforth to trouble you no more.
    Yes, yes: the lines are very quaintly writ;
But since unwillingly, take them again.
Nay, take them.

 Ay, ay: you writ them sir, at my request;
But I will none of them; they are for you;
I would have had them writ more movingly.

 And when it's writ, for my sake read it over,
And if it please you, so; if not, why, so.

  Why, if it please you, take it for your labor:
And so, good morrow, servant. Exit.
       Belike that now she hath enfranchised them
Upon some other pawn for fealty.

 Nay, then he should be blind; and, being blind,
How could he see his way to seek out you?

 Have done, have done; here comes the gentleman.
[Exit THURIO.
Enter PROTEUS
 His worth is warrant for his welcome hither,
If this be he you oft have wish'd to hear from.

 Too low a mistress for so high a servant.

 And duty never yet did want his meed:
Servant, you are welcome to a worthless mistress.

 That you are welcome?

 I wait upon his pleasure. Come, Sir Thurio,
Go with me. Once more, new servant, welcome:
I'll leave you to confer of home affairs;
When you have done, we look to hear from you.

 I thank you for your music, gentlemen.
Who is that that spake?

 Sir Proteus, as I take it.

 What's your will?

 You have your wish; my will is even this:
That presently you hie you home to bed.
Thou subtle, perjured, false, disloyal man!
Think'st thou I am so shallow, so conceitless,
To be seduced by thy flattery,
That hast deceived so many with thy vows?
Return, return and make thy love amends.
For me, by this pale queen of night I swear,
I am so far from granting thy request
That I despise thee for thy wrongful suit,
And by and by intend to chide myself
Even for this time I spend in talking to thee.

 Say that she be; yet Valentine thy friend
Survives; to whom, thyself art witness,
I am bethroth'd: and art thou not ashamed
To wrong him with thy importunacy?

 And so suppose am I; for in his grave
Assure thyself my love is buried.

 Go to thy lady's grave and call hers thence.
Or, at the least, in hers sepulchre thine.
   I am very loath to be your idol, sir;
But since your falsehood shall become you well
To worship shadows and adore false shapes,
Send to me in the morning and I'll send it:
And so, good rest.

 Who calls?

 Sir Eglamour, a thousand times good morrow.

 O Eglamour, thou art a gentleman--
Think not I flatter, for I swear I do not--
Valiant, wise, remorseful, well accomplish'd,
Thou art not ignorant what dear good will
I bear unto the banish'd Valentine
Nor how my father would enforce me marry
Vain Thurio, whom my very soul abhors.
Thyself hast loved; and I have heard thee say
No grief did ever come so near thy heart
As when thy lady and thy true love died,
Upon whose grave thou vow'dst pure chastity.
Sir Eglamour, I would to Valentine,
To Mantua, where I hear he makes abode;
And, for the ways are dangerous to pass,
I do desire thy worthy company,
Upon whose faith and honour I repose.
Urge not my father's anger, Eglamour,
But think upon my grief, a lady's grief,
And on the justice of my flying hence,
To keep me from a most unholy match,
Which heaven and fortune still rewards with plagues.
I do desire thee, even from a heart
As full of sorrows as the sea of sands,
To bear me company and go with me:
If not, to hide what I have said to thee,
That I may venture to depart alone.

 This evening coming.

 At Friar Patrick's cell,
Where I intend holy confession.

 Good morrow, kind Sir Eglamour.            [Exeunt severally.
 What would you with her, if that I be she?

 From whom?

 O, he sends you for a picture.

 Ursula, bring my picture there.
Go give your master this: tell him from me,
One Julia, that his changing thoughts forget,
Would better fit his chamber than this shadow.

 I pray thee, let me look on that again.

 There, hold!
I will not look upon your master's lines:
I know they are stuff'd with protestations
And full of new-found oaths; which he will break
As easily as I do tear his paper.

 The more shame for him that he sends it me;
For I have heard him say a thousand times
His Julia gave it him at his departure.
Though his false finger have profaned the ring,
Mine shall not do his Julia so much wrong.

 What say'st thou?

 Dost thou know her?

 Belike she thinks that Proteus hath forsook her.

 Is she not passing fair?

 How tall was she?

 She is beholding to thee, gentle youth.
Alas, poor lady, desolate and left!
I weep myself to think upon thy words.
Here, youth, there is my purse; I give thee this
For thy sweet mistress' sake, because thou lovest her.
Farewell.

[Exit Silvia, with attendants.
 Amen, amen! Go on, good Eglamour,
Out at the postern by the abbey-wall:
I fear I am attended by some spies.

 A thousand more mischances than this one
Have learn'd me how to brook this patiently.

 O Valentine, this I endure for thee!
                                      [Exeunt.
 O miserable, unhappy that I am!

 By thy approach thou makest me most unhappy.

 Had I been seized by a hungry lion,
I would have been a breakfast to the beast,
Rather than have false Proteus rescue me.
O, Heaven be judge how I love Valentine,
Whose life's as tender to me as my soul!
And full as much, for more there cannot be,
I do detest false perjured Proteus.
Therefore be gone; solicit me no more.

 When Proteus cannot love where he's beloved.
Read over Julia's heart, thy first best love,
For whose dear sake thou didst then rend thy faith
Into a thousand oaths; and all those oaths.
Descended into perjury, to love me.
Thou hast no faith left now, unless thou'dst two;
And that's far worse than none; better have none
Than plural faith which is too much by one:
Thou counterfeit to thy true friend!

 All men but Proteus.

 O heaven!

"
2,tgv-6,LUCETTA,Globe_Shakespeare/tgv.xml,0,Globe_Shakespeare/tgv.xml-tgv-6," Ay, madam, so you stumble not unheedfully.

 Please you repeat their names, I'll show my mind
According to my shallow simple skill.

 As of a knight well-spoken, neat and fine;
But, were I you, he never should be mine.

 Well of his wealth; but of himself, so so.

 Lord, Lord! to see what folly reigns in us!

 Pardon, dear madam: 'tis a passing shame
That I, unworthy body as I am,
Should censure thus on lovely gentlemen.

 Then thus: of many good I think him best.

 I have no other but a woman's reason;
I think him so because I think him so.

 Ay, if you thought your love not cast away.

 Yet he, of all the rest, I think, best loves ye.

 Fire that's closest kept burns most of all.

 O, they love least that let men know their love.

 Peruse this paper, madam.

 That the contents will show.

 Sir Valentine's page; and sent, I think, from Proteus.
He would have given it you; but I, being in the way,
Did in your name receive it: pardon the fault I pray.

 To plead for love deserves more fee than hate.

 That you may ruminate. [Exit.
 What would your ladyship?

 I would it were,
That you might kill your stomach on your meat
And not upon your maid.

 Nothing.

 To take a paper up that I let fall.

 Nothing concerning me.

 Madam, it will not lie where it concerns,
Unless it have a false interpreter.

 That I might sing it, madam, to a tune.
Give me a note: your ladyship can set.

 It is too heavy for so light a tune.

 Ay, and melodious were it, would you sing it.

 I cannot reach so high.

 Keep tune there still, so you will sing it out:
And yet methinks I do not like this tune.

 No, madam; it is too sharp.

 Nay, now you are too flat
And mar the concord with too harsh a descant:
There wanteth but a mean to fill your song.

 Indeed, I bid the base for Proteus.

 She makes it strange; but she would be best pleased
To be so anger'd with another letter. [Exit.
 Madam,
Dinner is ready, and your father stays.

 What, shall these papers lie like tell-tales here?

 Nay, I was taken up for laying them down:
Yet here they shall not lie, for catching cold.

 Ay, madam, you may say what sights you see;
I see things too, although you judge I wink.

 Alas, the way is wearisome and long!

 Better forbear till Proteus make return.

 I do not seek to quench your love's hot fire,
But qualify the fire's extreme rage,
Lest it should burn above the bounds of reason.

 But in what habit will you go along?

 Why, then, your ladyship must cut your hair.

 What fashion, madam, shall I make your breeches?

 You must needs have them with a codpiece, madam.

 A round hose, madam, now's not worth a pin,
Unless you have a codpiece to stick pins on.

 If you think so, then stay at home and go not.

 Then never dream on infamy, but go.
If Proteus like your journey when you come,
No matter who's displeased when you are gone:
I fear me, he will scarce be pleased withal.

 All these are servants to deceitful men.

 Pray heaven he prove so, when you come to him!

"
